{
  "$schema": "https://json-schema.org/draft/2020-12/schema",
  "$id": "https://local.invalid/research-kb/spec/corpus.schema.json",
  "type": "object",
  "additionalProperties": false,
  "properties": {
    "schema_version": {
      "const": "1.1.0"
    },
    "corpus_id": {
      "type": "string",
      "minLength": 1
    },
    "title": {
      "type": "string",
      "minLength": 1
    },
    "integration": {
      "enum": [
        "mcp",
        "codex",
        "claude"
      ],
      "description": "The agent adapter a library was set up for: mcp when any MCP agent may use it. Informational; project bindings decide access."
    },
    "modules": {
      "type": "array",
      "items": {
        "type": "object",
        "additionalProperties": false,
        "properties": {
          "module_id": {
            "type": "string",
            "minLength": 1
          },
          "title": {
            "type": "string",
            "minLength": 1
          },
          "description": {
            "type": "string",
            "minLength": 1
          }
        },
        "required": [
          "module_id",
          "title",
          "description"
        ]
      },
      "minItems": 1
    },
    "domains": {
      "type": "array",
      "items": {
        "type": "object",
        "additionalProperties": false,
        "properties": {
          "domain_id": {
            "type": "string",
            "minLength": 1
          },
          "title": {
            "type": "string",
            "minLength": 1
          }
        },
        "required": [
          "domain_id",
          "title"
        ]
      },
      "minItems": 1
    },
    "default_scope": {
      "type": "object",
      "additionalProperties": false,
      "properties": {
        "read_modules": {
          "type": "array",
          "items": {
            "type": "string",
            "minLength": 1
          },
          "minItems": 1
        },
        "write_modules": {
          "type": "array",
          "items": {
            "type": "string",
            "minLength": 1
          },
          "minItems": 0
        },
        "source_refs": {
          "type": "array",
          "items": {
            "type": "object",
            "additionalProperties": false,
            "properties": {
              "id": {
                "type": "string",
                "pattern": "^[a-z][a-z0-9_-]*:[a-z0-9][a-z0-9_-]*$"
              },
              "revision": {
                "type": "integer",
                "minimum": 1
              }
            },
            "required": [
              "id",
              "revision"
            ]
          },
          "minItems": 0
        }
      },
      "required": [
        "read_modules",
        "write_modules",
        "source_refs"
      ]
    },
    "project_bindings": {
      "type": "array",
      "items": {
        "type": "object",
        "additionalProperties": false,
        "properties": {
          "project_id": {
            "type": "string",
            "minLength": 1
          },
          "read_modules": {
            "type": "array",
            "items": {
              "type": "string",
              "minLength": 1
            },
            "minItems": 1
          },
          "write_modules": {
            "type": "array",
            "items": {
              "type": "string",
              "minLength": 1
            },
            "minItems": 0
          }
        },
        "required": [
          "project_id",
          "read_modules",
          "write_modules"
        ]
      },
      "minItems": 1
    }
  },
  "required": [
    "schema_version",
    "corpus_id",
    "title",
    "integration",
    "modules",
    "domains",
    "default_scope",
    "project_bindings"
  ]
}
